Variable,Label,Mean,Min,Max,StdDev,Valid,Invalid,Variance
difstand,"SOME PPL HOLD STANDARD IN WORKPLACE THAT OTHERS DONT",2.293,1.0,4.0,1.088,2905.0,56694.0,1.185
rptprobs,"PPL FEEL FREE TO REPORT PROBLEMS IN WORKPLACE",1.736,1.0,4.0,0.938,1794.0,57805.0,0.88
othcredt,"OTHER PEPLE TAKE CREDIT FOR RS WORK OR IDEAS",3.049,1.0,4.0,0.973,2931.0,56668.0,0.947
putdown,"PPL AT WORK TREAT R IN A MANNER PUTTING R DOWN",3.414,1.0,4.0,0.822,2937.0,56662.0,0.675
lackinfo,"PPL AT WORK FAIL TO GIVE R NECESSARY INFO",2.892,1.0,4.0,0.977,2941.0,56658.0,0.955
perspace,"PPL AT WORK GET IN RS PERSONAL SPACE TO INTIMIDATE",3.58,1.0,4.0,0.747,1806.0,57793.0,0.557
physharm,"R HAVE BEEN THREATENED WITH PHYSICAL HARM AT WORK",3.883,1.0,4.0,0.435,1806.0,57793.0,0.189
actupset,"PPL AT WORK THROW THINGS WHEN UPSET WITH R",3.766,1.0,4.0,0.609,2942.0,56657.0,0.37
shout,"PPL AT WORK SHOUT AT R IN HOSTILE MANNER",3.656,1.0,4.0,0.697,2940.0,56659.0,0.486
hotargus,"HEATED ARGUMENTS OCCUR IN WORKPLACE",3.211,1.0,4.0,0.893,1807.0,57792.0,0.797
reliedon,"PPL AT WORK CAN BE RELIED ON WHEN NEEDS HELP",1.463,1.0,4.0,0.663,1805.0,57794.0,0.439
gdjobsec,"JOB SECURITY IS GOOD",1.638,1.0,4.0,0.816,1809.0,57790.0,0.666
treatres,"PEOPLE ARE TREATED WITH RESPECT",1.721,1.0,4.0,0.664,2939.0,56660.0,0.442
lookaway,"PPL LOOK THE OTHER WAY WHEN OTHERS ARE THREATENED",3.156,1.0,4.0,0.806,2887.0,56712.0,0.65
skipwork,"HOW OFTEN R STAYED AT HOME OR LEAVE WORK EARLY",3.753,1.0,4.0,0.574,1825.0,57774.0,0.33
numemps,"NUMBER OF EMPLOYEE FOR THE SELF-EMPLOYED",3.401,0.0,97.0,10.491,1798.0,57801.0,110.058
IGNORWK,"FEEL IGNORED AT WORK",3.444,1.0,4.0,0.807,1134.0,58465.0,0.651
RUMORWK,"RUMORS OR GOSSIP ABOUT R AT WORK",3.547,1.0,4.0,0.774,1119.0,58480.0,0.599
JOKESWK,"TARGET OF DEROGATORY COMMENTS OR JOKES AT WORK",3.591,1.0,4.0,0.755,1126.0,58473.0,0.571
EHARASWK,"HARASSED ELECTRONICALLY AT WORK",3.932,1.0,4.0,0.322,1135.0,58464.0,0.104
RUDEWK,"TREATED RUDELY AT WORK",3.473,1.0,4.0,0.792,1137.0,58462.0,0.628
LIEDCWKR,"LIED TO AT WORK",3.312,1.0,4.0,0.882,1129.0,58470.0,0.779
DENYRAIS,"DENIED RAISE WITHOUT REASON AT WORK",3.645,1.0,4.0,0.759,1135.0,58464.0,0.577
WKBHVRS,"EMPLOYEE DOING THESE THINGS AT WORK TO R",1.788,1.0,3.0,0.836,679.0,58920.0,0.698
WKRSPNS,"What did you typically do in response to these behaviors?",3.298,1.0,8.0,2.098,732.0,58867.0,4.404
natborn,"WHAT COUNTRY R WERE BORN IN",23.889,1.0,75.0,20.674,270.0,59329.0,427.423
bornhome,"WHAT KIND OF HOUSE RS FAMILY LIVED AT BIRTH",1.884,1.0,4.0,0.551,250.0,59349.0,0.304
travelus,"TRANSPORTATION R TOOK WHEN TRAVELLING TO US",1.972,1.0,4.0,0.44,253.0,59346.0,0.194
immstats,"RS CURRENT IMMIGRATION STATUS RIGHT NOW",1.694,1.0,4.0,0.623,252.0,59347.0,0.388
rundrstd,"DID R APPEAR TO UNDERSTAND 3-BOX ANSWER FORMAT",1.212,1.0,3.0,0.54,259.0,59340.0,0.292
robject,"DID R OBJECT TO OR DELAY ANSWERING CARD C4",2.958,1.0,4.0,0.32,260.0,59339.0,0.102
genevig1,"VIGNETTE NUMBER USED",16.569,1.0,32.0,9.233,2812.0,56787.0,85.248
genevig2,"VIGNETTE ORDER USED",12.421,1.0,24.0,6.988,2812.0,56787.0,48.829
genenvo1,"GENE OR LEARNIGN?:OVERWEIGHT WHITE WOMAM GAINS WEIGHT",12.532,1.0,21.0,6.067,2354.0,57245.0,36.813
genenvo2,"GENE OR LEARNIGN?:DRUNK ASIAN MAN CANT REMEMBER",12.189,1.0,21.0,6.109,2349.0,57250.0,37.315
genenvo3,"GENE OR LEARNIGN?:KIND HISPANIC WOMAN NEVER DOES BAD T",12.294,1.0,21.0,6.121,2348.0,57251.0,37.463
genenvo4,"GENE OR LEARNIGN?:GOOD ALL-ROUND BLACK MAN FREQUENTLY",11.971,1.0,21.0,6.012,2351.0,57248.0,36.144
satself,"ON THE WHOLE I AM SATISFIED WITH MYSELF",1.755,1.0,4.0,0.644,2375.0,57224.0,0.415
afailure,"I AM INCLINED TO FEEL I AM A FAILURE",3.396,1.0,4.0,0.712,2373.0,57226.0,0.507
slfrspct,"I WISH I COULD HAVE MORE RESPECT FOR MYSELF",2.984,1.0,4.0,0.878,2370.0,57229.0,0.771
ofworth,"I AM A PERSON OF WORTH AT LEAST EQUAL TO OTHERS",1.475,1.0,4.0,0.615,2375.0,57224.0,0.378
nogood,"AT TIMES I THINK I AM NO GOOD AT ALL",3.218,1.0,4.0,0.818,2373.0,57226.0,0.669
optimist,"I AM ALWAYS OPTIMISTIC ABOUT MY FUTURE",1.892,1.0,4.0,0.718,2367.0,57232.0,0.515
pessimst,"I HARDLY EVER EXPECT THINGS TO GO MY WAY",2.951,1.0,4.0,0.74,2368.0,57231.0,0.548
notcount,"I RARELY COUNT ON GOOD THINGS HAPPENING TO ME",2.906,1.0,4.0,0.803,2370.0,57229.0,0.645
moregood,"I EXPECT MORE GOOD THINGS TO HAPPEN TO ME THAN BAD",1.774,1.0,4.0,0.668,2371.0,57228.0,0.447
owndoing,"DEGREE OF INFLUENCE OVER WHAT HAPPENS TO ME",1.855,1.0,2.0,0.352,2349.0,57250.0,0.124
geneexps,"GENES OR EXPERIENCES IN DETERMINING PERSONALITY",1.746,1.0,2.0,0.436,2311.0,57288.0,0.19
depndabl,"R IS A DEPENDABLE PERSON",1.615,1.0,5.0,0.74,2374.0,57225.0,0.547
sadblue,"R IS A PERSON WHO FEELS SAD AND BLUE",4.075,1.0,5.0,0.875,2374.0,57225.0,0.766
athletic,"R IS AN ATHLETIC PERSON",3.12,1.0,5.0,1.167,2373.0,57226.0,1.361
kindpers,"R IS A KIND PERSON",1.585,1.0,5.0,0.685,2375.0,57224.0,0.469
selfish,"R IS A SELFISH PERSON",4.217,1.0,5.0,0.789,2372.0,57227.0,0.623
intrwght,"INTERVIEW ASSESSMENT OF Rs WEIGHT",2.218,1.0,4.0,0.627,2265.0,57334.0,0.393
agape1,"WOULD SUFFER THAN LET THE ONE R LOVE SUFFER",1.556,1.0,5.0,0.837,1330.0,58269.0,0.7
agape2,"NOT HAPPY UNLESS THE ONE S HAPPINESS IS BEFORE R",2.137,1.0,5.0,1.108,1331.0,58268.0,1.227
agape3,"WILLING TO SACRIFICE WISH TO LET THE ONE ACHIEVE",1.914,1.0,5.0,0.928,1330.0,58269.0,0.861
agape4,"WOULD ENDURE ALL THINGS FOR THE ONE R LOVE",1.952,1.0,5.0,1.073,1329.0,58270.0,1.151
hgunlaw,"SHOULD BE MORE RESTRICTIONS ON HANDGUN",1.294,1.0,2.0,0.456,1308.0,58291.0,0.208
hguncrim,"MORE RESTRICTIONS ON HANDGUN DECREASE CRIME",1.897,1.0,3.0,0.892,1295.0,58304.0,0.796
crimup,"WHAT IF MORE RESTRICTIONS INCREASE CRIME",1.629,1.0,2.0,0.483,788.0,58811.0,0.234
crimdown,"WHAT IF MORE RESTRICTIONS REDUCE CRIME",1.74,1.0,2.0,0.439,323.0,59276.0,0.193
numrelex,"NUMBER OF REAL EXPERIENCE THAT CHANGED Rs LIFE",2.316,1.0,8.0,2.026,624.0,58975.0,4.104
agerelex,"AGE OF R AT RELIGIOUS EXPERIENCE",31.36,1.0,80.0,14.92,572.0,59027.0,222.62
chngrel,"R CHANGED RELIGION BECAUSE OF EXPERIENCE",2.062,1.0,9.0,1.114,601.0,58998.0,1.241
numrborn,"HOW MANY BORN-AGAIN EXPERIENCE R HAD",2.357,1.0,9.0,2.951,56.0,59543.0,8.706
agerborn,"AGE OF R AT BORN-AGAIN EXPERIENCE",38.339,0.0,99.0,33.118,56.0,59543.0,1096.81
chngrbrn,"R CHANGED RELIGION BECAUSE OF EXPERIENCE",1.896,1.0,2.0,0.309,48.0,59551.0,0.095
entity,"ENTITY MENTIONS IN RELIGIOUS CHANGE",65.562,1.0,96.0,44.153,617.0,58982.0,1949.461
expchng1,"CAUSE OF RELIGIOUS CHANGE1",79.741,1.0,97.0,31.076,610.0,58989.0,965.746
expchng2,"CAUSE OF RELIGIOUS CHANGE2",93.666,1.0,97.0,13.298,613.0,58986.0,176.847
expchng3,"CAUSE OF RELIGIOUS CHANGE3",95.778,2.0,96.0,4.156,613.0,58986.0,17.271
whychng1,"RELIGIOUS CHANGE EXPERIENCE1",38.061,1.0,97.0,32.644,611.0,58988.0,1065.65
whychng2,"RELIGIOUS CHANGE EXPERIENCE2",76.321,1.0,97.0,31.464,617.0,58982.0,989.962
whychng3,"RELIGIOUS CHANGE EXPERIENCE3",93.104,5.0,97.0,13.328,617.0,58982.0,177.635
changed1,"LIFE CHANGES FROM RELIGIOUS CHANGE1",40.814,1.0,96.0,34.005,614.0,58985.0,1156.35
changed2,"LIFE CHANGES FROM RELIGIOUS CHANGE2",80.85,1.0,96.0,29.593,615.0,58984.0,875.717
changed3,"LIFE CHANGES FROM RELIGIOUS CHANGE3",93.124,1.0,96.0,13.182,615.0,58984.0,173.757
relalt1,"REL CHANGE ALTERED RS OUTLOOK ON LIFE",5.894,1.0,9.0,1.539,649.0,58950.0,2.37
relalt2,"REL CHANGE MADE R SENSE LIFE WAS MEANINGFUL",5.946,1.0,9.0,1.556,649.0,58950.0,2.421
relalt3,"REL CHANGE CHANGED GOALS IN LIFE",5.072,1.0,9.0,2.075,649.0,58950.0,4.305
relalt4,"REL CHANGE POSITIVELY AFFECTED RELATION WITH OTHERS",5.632,1.0,9.0,1.801,649.0,58950.0,3.242
relalt5,"REL CHANGE CHANGED DAY TO DAY ACTIVITIES",4.713,1.0,9.0,2.102,649.0,58950.0,4.418
relalt6,"REL CHANGE CHANGED LIFE OVERALL",5.604,1.0,9.0,1.778,649.0,58950.0,3.162
alloflfe,"EXPERIENCE CONNECTION TO ALL OF LIFE",3.078,1.0,6.0,1.486,1272.0,58327.0,2.207
joylifts,"FEEL JOY DURING WORSHIP",3.425,1.0,6.0,1.63,1312.0,58287.0,2.658
relsprt1,"FIND STRENGTH RELIGION OR SPIRITUALITY",3.012,1.0,6.0,1.643,1318.0,58281.0,2.698
relsprt2,"FIND COMFORT IN RELIGION OR SPIRITUALITY",2.91,1.0,6.0,1.593,1317.0,58282.0,2.539
godhelp,"ASK FOR GODS HELP IN DAILY ACTIVITIES",3.118,1.0,6.0,1.737,1321.0,58278.0,3.018
godguide,"FEEL GUIDED BY GOD IN DAILY ACTIVITIES",3.304,1.0,6.0,1.733,1318.0,58281.0,3.003
godlvdir,"FEEL GODS LOVE FOR R DIRECTLY",3.057,1.0,6.0,1.733,1317.0,58282.0,3.002
godlvoth,"FEEL GODS LOVE FOR ME THROUGH OTHERS",3.277,1.0,6.0,1.607,1308.0,58291.0,2.581
blessngs,"FEEL THANKFUL FOR RS BLESSINGS",2.112,1.0,6.0,1.117,1323.0,58276.0,1.248
closrgod,"DESIRE TO BE CLOSER TO GOD",2.967,1.0,6.0,1.609,1312.0,58287.0,2.59
godclose,"HOW CLOSE TO GOD",2.589,1.0,4.0,0.894,1317.0,58282.0,0.798
idols,"CATHOLICS ARE IDOLS",2.849,1.0,5.0,1.135,1290.0,58309.0,1.289
rosaries,"CATHOLIC ROSARIES ARE SUPERSTITIOUS",3.25,1.0,5.0,1.097,1286.0,58313.0,1.204
notthink,"CATHOLICS ARE NOT PERMITTED TO THINK",3.398,1.0,5.0,1.037,1280.0,58319.0,1.075
evdrink,"EVER DRANK ANY ALCOHOLIC BEVERAGE",1.172,1.0,2.0,0.378,808.0,58791.0,0.143
drinkyr,"HOW REGULARLY R DRINK OVER LAST 12 MONTHS",3.616,1.0,8.0,2.065,310.0,59289.0,4.263
drinkday,"HOW MANY DRINKS R HAVE ON A DAY WHEN DRINKING",2.049,1.0,12.0,1.55,243.0,59356.0,2.403
drink6up,"HOW OFTEN R HAS 6 OR MORE DRINKS IN A DAY",1.812,1.0,8.0,1.517,245.0,59354.0,2.301
drinkmax,"LARGEST NUMBER OF DRINKS IN A DAY LAST 12 MONTHS",2.213,0.0,7.0,1.574,356.0,59243.0,2.478
drink12,"HOW OFTEN AT LEAST 12 BUT LESS THAN 20 DRINKS",4.471,2.0,8.0,1.736,17.0,59582.0,3.015
drink8,"HOW OFTEN AT LEAST 8 BUT LESS THAN 12 DRINKS",4.464,1.0,8.0,1.856,28.0,59571.0,3.443
drink5,"HOW OFTEN AT LEAST 5 BUT LESS THAN 8 DRINKS",4.492,1.0,8.0,1.894,61.0,59538.0,3.587
drink3,"HOW OFTEN AT LEAST 3 BUT LESS THAN 5 DRINKS",4.615,1.0,9.0,1.823,130.0,59469.0,3.324
drink1,"HOW OFTEN AT LEAST 1 BUT LESS THAN 3 DRINKS",4.861,1.0,9.0,1.944,259.0,59340.0,3.779
drinkmin,"HOW OFTEN AT LEAST A SIP BUT LESS THAN ONE FULL DRINK",3.362,1.0,9.0,2.454,351.0,59248.0,6.02
churchtx,"MEMBERSHIP IN CHURCH-RELATED GROUPS",1.474,1.0,2.0,0.5,454.0,59145.0,0.25
infrmgrp,"ANY ACTIVITIES WITH THE SAME GROUP OF PPL REGULARLY",1.731,1.0,2.0,0.444,1465.0,58134.0,0.197
typfrat,"R BELONGS TO MORE THAN ONE FRATERNAL GROUPS",1.808,1.0,2.0,0.396,99.0,59500.0,0.157
typserv,"R BELONGS TO MORE THAN ONE SERVICE CLUBS",1.771,1.0,2.0,0.421,140.0,59459.0,0.178
typvet,"R BELONGS TO MORE THAN ONE VETERANS GROUPS",1.87,1.0,2.0,0.338,77.0,59522.0,0.114
typpolit,"R BELONGS TO MORE THAN ONE POLITICAL CLUBS",1.869,1.0,2.0,0.34,61.0,59538.0,0.116
typunion,"R BELONGS TO MORE THAN ONE LABOR UNIONS",1.914,1.0,2.0,0.281,140.0,59459.0,0.079
typsport,"R BELONGS TO MORE THAN ONE SPORTS GROUPS",1.734,1.0,2.0,0.443,244.0,59355.0,0.196
typyouth,"R BELONGS TO MORE THAN ONE YOUTH GROUPS",1.913,1.0,2.0,0.283,149.0,59450.0,0.08
typschl,"R BELONGS TO MORE THAN ONE SCHOOL SERVICE GROUPS",1.901,1.0,2.0,0.299,203.0,59396.0,0.089
typhobby,"R BELONGS TO MORE THAN ONE HOBBY CLUBS",1.873,1.0,2.0,0.334,158.0,59441.0,0.111
typgreek,"R BELONGS TO MORE THAN ONE SCHOOL FRATERNITIES",1.966,1.0,2.0,0.183,59.0,59540.0,0.033
typnat,"R BELONGS TO MORE THAN ONE NATIONALITY GROUPS",1.947,1.0,2.0,0.226,38.0,59561.0,0.051
typfarm,"R BELONGS TO MORE THAN ONE FARM ORGANIZATIONS",1.932,1.0,2.0,0.255,44.0,59555.0,0.065
typlit,"R BELONGS TO MORE THAN ONE LITERARY GROUPS",1.862,1.0,2.0,0.346,152.0,59447.0,0.12
typprof,"R BELONGS TO MORE THAN ONE PROFESSIONAL SOCIETIES",1.662,1.0,2.0,0.474,216.0,59383.0,0.225
typchurh,"R BELONGS TO MORE THAN ONE CHURCH AFFILIATE GROUPS",1.88,1.0,2.0,0.326,449.0,59150.0,0.106
typother,"R BELONGS TO MORE THAN ONE OTHER GROUPS",1.907,1.0,2.0,0.292,97.0,59502.0,0.085
typinfrm,"R BELONGS TO MORE THAN ONE INFORMAL GROUPS",1.758,1.0,2.0,0.429,389.0,59210.0,0.184
numfrat,"HOW MANY R BELONGS TO FRATERNAL GROUPS",1.242,1.0,4.0,0.555,99.0,59500.0,0.308
numserv,"HOW MANY R BELONGS TO SERVICE CLUBS",1.386,1.0,7.0,0.853,140.0,59459.0,0.728
numvet,"HOW MANY R BELONGS TO VETERANS GROUPS",1.197,1.0,5.0,0.654,76.0,59523.0,0.427
numpolit,"HOW MANY R BELONGS TO POLITICAL CLUBS",1.213,1.0,3.0,0.581,61.0,59538.0,0.337
numunion,"HOW MANY R BELONGS TO LABOR UNIONS",1.101,1.0,4.0,0.386,139.0,59460.0,0.149
numsport,"HOW MANY R BELONGS TO SPORTS GROUPS",1.377,1.0,6.0,0.729,244.0,59355.0,0.532
numyouth,"HOW MANY R BELONGS TO YOUTH GROUPS",1.108,1.0,5.0,0.439,148.0,59451.0,0.192
numschl,"HOW MANY R BELONGS TO SCHOOL SERVICE GROUPS",1.119,1.0,4.0,0.406,202.0,59397.0,0.165
numhobby,"HOW MANY R BELONGS TO HOBBY CLUBS",1.159,1.0,3.0,0.46,157.0,59442.0,0.212
numgreek,"HOW MANY R BELONGS TO SCHOOL FRATERNITIES",1.034,1.0,2.0,0.183,59.0,59540.0,0.033
numnat,"HOW MANY R BELONGS TO NATIONALITY GROUPS",1.053,1.0,2.0,0.226,38.0,59561.0,0.051
numfarm,"HOW MANY R BELONGS TO FARM ORGANIZATIONS",1.091,1.0,3.0,0.362,44.0,59555.0,0.131
numlit,"HOW MANY R BELONGS TO LITERARY GROUPS",1.16,1.0,4.0,0.465,150.0,59449.0,0.216
numprof,"HOW MANY R BELONGS TO PROFESSIONAL SOCIETIES",1.521,1.0,6.0,0.909,213.0,59386.0,0.826
numchurh,"HOW MANY R BELONGS TO CHURCH AFFILIATE GROUPS",1.177,1.0,6.0,0.558,447.0,59152.0,0.312
numother,"HOW MANY R BELONGS TO OTHER GROUPS",1.165,1.0,5.0,0.64,97.0,59502.0,0.41
numinfrm,"HOW MANY R BELONGS TO INFORMAL GROUPS",1.348,1.0,5.0,0.751,382.0,59217.0,0.564
yrfrat1,"HOW MANY YRS R BEEN A MEMBER OF FRATERNAL GROUPS1",17.255,0.0,71.0,16.868,94.0,59505.0,284.536
yrfrat2,"HOW MANY YRS R BEEN A MEMBER OF FRATERNAL GROUPS2",15.667,0.0,50.0,13.852,18.0,59581.0,191.882
yrfrat3,"HOW MANY YRS R BEEN A MEMBER OF FRATERNAL GROUPS3",18.667,3.0,44.0,22.143,3.0,59596.0,490.333
yrfrat4,"HOW MANY YRS R BEEN A MEMBER OF FRATERNAL GROUPS4",9.0,9.0,9.0,0.0,1.0,59598.0,0.0
yrserv1,"HOW MANY YEARS R BEEN A MEMBER OF SERVICE CLUB1",9.279,0.0,52.0,10.148,140.0,59459.0,102.979
yrserv2,"HOW MANY YEARS R BEEN A MEMBER OF SERVICE CLUB2",7.967,1.0,40.0,8.181,30.0,59569.0,66.93
yrserv3,"HOW MANY YEARS R BEEN A MEMBER OF SERVICE CLUB3",5.571,1.0,24.0,5.612,14.0,59585.0,31.495
yrserv4,"HOW MANY YEARS R BEEN A MEMBER OF SERVICE CLUB4",6.5,3.0,10.0,4.95,2.0,59597.0,24.5
yrserv5,"HOW MANY YEARS R BEEN A MEMBER OF SERVICE CLUB5",18.0,18.0,18.0,0.0,1.0,59598.0,0.0
yrserv6,"HOW MANY YEARS R BEEN A MEMBER OF SERVICE CLUB6",1.0,1.0,1.0,0.0,1.0,59598.0,0.0
yrserv7,"HOW MANY YEARS R BEEN A MEMBER OF SERVICE CLUB7",4.0,4.0,4.0,0.0,1.0,59598.0,0.0
yrserv8,"HOW MANY YEARS R BEEN A MEMBER OF SERVICE CLUB8",31.0,31.0,31.0,0.0,1.0,59598.0,0.0
yrvet1,"HOW MANY YEARS R BEEN A MEMBER OF VETERAN GROUPS1",16.239,0.0,58.0,15.912,71.0,59528.0,253.185
yrvet2,"HOW MANY YEARS R BEEN A MEMBER OF VETERAN GROUPS2",17.333,1.0,40.0,14.534,9.0,59590.0,211.25
yrvet3,"HOW MANY YEARS R BEEN A MEMBER OF VETERAN GROUPS3",9.0,3.0,18.0,7.937,3.0,59596.0,63.0
yrvet4,"HOW MANY YEARS R BEEN A MEMBER OF VETERAN GROUPS4",10.0,10.0,10.0,0.0,1.0,59598.0,0.0
yrvet5,"HOW MANY YEARS R BEEN A MEMBER OF VETERAN GROUPS5",15.0,15.0,15.0,0.0,1.0,59598.0,0.0
yrpolit1,"HOW MANY YEARS R BEEN A MEMBER OF POLITICAL CLUB1",10.0,0.0,50.0,11.319,56.0,59543.0,128.109
yrpolit2,"HOW MANY YEARS R BEEN A MEMBER OF POLITICAL CLUB2",10.0,1.0,30.0,10.61,8.0,59591.0,112.571
yrpolit3,"HOW MANY YEARS R BEEN A MEMBER OF POLITICAL CLUB3",7.25,1.0,20.0,8.617,4.0,59595.0,74.25
yrunion1,"HOW MANY YEARS R BORN A MEMBER OF LABOR UNION1",13.555,0.0,45.0,11.524,137.0,59462.0,132.793
yrunion2,"HOW MANY YEARS R BORN A MEMBER OF LABOR UNION2",15.182,1.0,40.0,13.37,11.0,59588.0,178.764
yrunion3,"HOW MANY YEARS R BORN A MEMBER OF LABOR UNION3",30.0,25.0,35.0,7.071,2.0,59597.0,50.0
yrunion4,"HOW MANY YEARS R BORN A MEMBER OF LABOR UNION4",35.0,35.0,35.0,0.0,1.0,59598.0,0.0
yrsport1,"HOW MANY YEARS R BORN A MEMBER OF SPORTS GROUPS1",8.975,0.0,50.0,9.758,242.0,59357.0,95.228
yrsport2,"HOW MANY YEARS R BORN A MEMBER OF SPORTS GROUPS2",7.159,0.0,40.0,8.657,63.0,59536.0,74.942
yrsport3,"HOW MANY YEARS R BORN A MEMBER OF SPORTS GROUPS3",8.947,1.0,40.0,11.123,19.0,59580.0,123.719
yrsport4,"HOW MANY YEARS R BORN A MEMBER OF SPORTS GROUPS4",12.0,5.0,25.0,11.269,3.0,59596.0,127.0
yrsport5,"HOW MANY YEARS R BORN A MEMBER OF SPORTS GROUPS5",0.0,,,0.0,0.0,59599.0,0.0
yrsport6,"HOW MANY YEARS R BORN A MEMBER OF SPORTS GROUPS6",0.0,,,0.0,0.0,59599.0,0.0
yryouth1,"HOW MANY YEARS R BORN A MEMBER OF YOUTH GROUPS1",6.403,0.0,50.0,7.432,144.0,59455.0,55.235
yryouth2,"HOW MANY YEARS R BORN A MEMBER OF YOUTH GROUPS2",5.1,1.0,15.0,4.581,10.0,59589.0,20.989
yryouth3,"HOW MANY YEARS R BORN A MEMBER OF YOUTH GROUPS3",2.0,1.0,3.0,1.414,2.0,59597.0,2.0
yryouth4,"HOW MANY YEARS R BORN A MEMBER OF YOUTH GROUPS4",1.0,1.0,1.0,0.0,1.0,59598.0,0.0
yryouth5,"HOW MANY YEARS R BORN A MEMBER OF YOUTH GROUPS5",1.0,1.0,1.0,0.0,1.0,59598.0,0.0
yrschl1,"HOW MANY YEARS R BORN A MEMBER OF SCHOOL SERVICE GROUP1",5.738,0.0,52.0,7.828,191.0,59408.0,61.278
yrschl2,"HOW MANY YEARS R BORN A MEMBER OF SCHOOL SERVICE GROUP2",5.882,1.0,23.0,5.6,17.0,59582.0,31.36
yrschl3,"HOW MANY YEARS R BORN A MEMBER OF SCHOOL SERVICE GROUP3",1.75,1.0,3.0,0.957,4.0,59595.0,0.917
yrschl4,"HOW MANY YEARS R BORN A MEMBER OF SCHOOL SERVICE GROUP4",1.0,1.0,1.0,0.0,1.0,59598.0,0.0
yrhobby1,"HOW MANY YEARS R BORN A MEMBER OF HOBBY CLUB1",6.607,0.0,50.0,7.876,150.0,59449.0,62.025
yrhobby2,"HOW MANY YEARS R BORN A MEMBER OF HOBBY CLUB1",7.316,1.0,40.0,9.434,19.0,59580.0,89.006
yrhobby3,"HOW MANY YEARS R BORN A MEMBER OF HOBBY CLUB1",4.0,0.0,10.0,4.0,6.0,59593.0,16.0
yrgreek1,"HOW MANY YEARS R BORN A MEMBER OF SCHOOL FRATERNITY1",16.466,0.0,64.0,15.443,58.0,59541.0,238.499
yrgreek2,"HOW MANY YEARS R BORN A MEMBER OF SCHOOL FRATERNITY2",31.5,13.0,50.0,26.163,2.0,59597.0,684.5
yrgreek3,"HOW MANY YEARS R BORN A MEMBER OF SCHOOL FRATERNITY3",0.0,,,0.0,0.0,59599.0,0.0
yrnat1,"HOW MANY YEARS R BORN A MEMBER OF NATIONAL GROUP1",12.444,0.0,40.0,11.216,36.0,59563.0,125.797
yrnat2,"HOW MANY YEARS R BORN A MEMBER OF NATIONAL GROUP2",4.5,4.0,5.0,0.707,2.0,59597.0,0.5
yrnat3,"HOW MANY YEARS R BORN A MEMBER OF NATIONAL GROUP3",0.0,,,0.0,0.0,59599.0,0.0
yrfarm1,"HOW MANY YEARS R BORN A MEMBER OF FARM ORGANIZATION1",12.651,0.0,50.0,11.309,43.0,59556.0,127.899
yrfarm2,"HOW MANY YEARS R BORN A MEMBER OF FARM ORGANIZATION2",17.0,14.0,20.0,4.243,2.0,59597.0,18.0
yrfarm3,"HOW MANY YEARS R BORN A MEMBER OF FARM ORGANIZATION3",20.0,20.0,20.0,0.0,1.0,59598.0,0.0
yrlit1,"HOW MANY YEARS R BORN A MEMBER OF LITERARY GROUP1",6.272,0.0,58.0,8.578,147.0,59452.0,73.583
yrlit2,"HOW MANY YEARS R BORN A MEMBER OF LITERARY GROUP2",6.421,1.0,54.0,12.54,19.0,59580.0,157.257
yrlit3,"HOW MANY YEARS R BORN A MEMBER OF LITERARY GROUP3",2.25,1.0,4.0,1.5,4.0,59595.0,2.25
yrlit4,"HOW MANY YEARS R BORN A MEMBER OF LITERARY GROUP4",2.0,2.0,2.0,0.0,1.0,59598.0,0.0
yrprof1,"HOW MANY YEARS R BORN A MEMBER OF PROFESSIONAL SOCIETY1",10.3,0.0,60.0,10.606,207.0,59392.0,112.492
yrprof2,"HOW MANY YEARS R BORN A MEMBER OF PROFESSIONAL SOCIETY2",9.507,1.0,43.0,9.222,69.0,59530.0,85.048
yrprof3,"HOW MANY YEARS R BORN A MEMBER OF PROFESSIONAL SOCIETY3",8.826,1.0,31.0,7.866,23.0,59576.0,61.877
yrprof4,"HOW MANY YEARS R BORN A MEMBER OF PROFESSIONAL SOCIETY4",11.75,2.0,31.0,11.081,8.0,59591.0,122.786
yrprof5,"HOW MANY YEARS R BORN A MEMBER OF PROFESSIONAL SOCIETY5",6.75,1.0,18.0,7.632,4.0,59595.0,58.25
yrprof6,"HOW MANY YEARS R BORN A MEMBER OF PROFESSIONAL SOCIETY6",0.0,,,0.0,0.0,59599.0,0.0
yrchurh1,"HOW MANY YEARS R BORN A MEMBER OF CHURCH GROUP1",10.898,0.0,75.0,13.742,430.0,59169.0,188.843
yrchurh2,"HOW MANY YEARS R BORN A MEMBER OF CHURCH GROUP2",9.769,0.0,56.0,11.832,52.0,59547.0,139.985
yrchurh3,"HOW MANY YEARS R BORN A MEMBER OF CHURCH GROUP3",11.211,1.0,70.0,17.903,19.0,59580.0,320.509
yrchurh4,"HOW MANY YEARS R BORN A MEMBER OF CHURCH GROUP4",12.5,1.0,43.0,20.355,4.0,59595.0,414.333
yrchurh5,"HOW MANY YEARS R BORN A MEMBER OF CHURCH GROUP5",43.0,43.0,43.0,0.0,1.0,59598.0,0.0
yrchurh6,"HOW MANY YEARS R BORN A MEMBER OF CHURCH GROUP6",43.0,43.0,43.0,0.0,1.0,59598.0,0.0
yrother1,"HOW MANY YEARS R BORN A MEMBER OF OTHER GROUP1",5.141,0.0,40.0,8.402,78.0,59521.0,70.59
yrother2,"HOW MANY YEARS R BORN A MEMBER OF OTHER GROUP2",7.5,1.0,24.0,8.485,8.0,59591.0,72.0
yrother3,"HOW MANY YEARS R BORN A MEMBER OF OTHER GROUP3",10.333,4.0,15.0,5.686,3.0,59596.0,32.333
yrother4,"HOW MANY YEARS R BORN A MEMBER OF OTHER GROUP4",11.0,10.0,12.0,1.414,2.0,59597.0,2.0
yrother5,"HOW MANY YEARS R BORN A MEMBER OF OTHER GROUP5",10.5,1.0,20.0,13.435,2.0,59597.0,180.5
yrinfrm1,"HOW MANY YEARS R BORN A MEMBER OF INFORMAL GROUP1",6.496,0.0,74.0,9.198,355.0,59244.0,84.601
yrinfrm2,"HOW MANY YEARS R BORN A MEMBER OF INFORMAL GROUP2",7.847,0.0,60.0,9.823,85.0,59514.0,96.488
yrinfrm3,"HOW MANY YEARS R BORN A MEMBER OF INFORMAL GROUP3",9.938,0.0,44.0,12.337,32.0,59567.0,152.19
yrinfrm4,"HOW MANY YEARS R BORN A MEMBER OF INFORMAL GROUP4",15.0,3.0,38.0,12.693,10.0,59589.0,161.111
yrinfrm5,"HOW MANY YEARS R BORN A MEMBER OF INFORMAL GROUP5",6.5,4.0,10.0,2.646,4.0,59595.0,7.0
mtfrat1,"HOW MANY YEARS R BORN A MEMBER OF FRATERNITY GROUP1",1.198,1.0,2.0,0.401,96.0,59503.0,0.16
mtfrat2,"HOW MANY YEARS R BORN A MEMBER OF FRATERNITY GROUP2",1.167,1.0,2.0,0.383,18.0,59581.0,0.147
mtfrat3,"HOW MANY YEARS R BORN A MEMBER OF FRATERNITY GROUP3",1.0,1.0,1.0,0.0,3.0,59596.0,0.0
mtfrat4,"HOW MANY YEARS R BORN A MEMBER OF FRATERNITY GROUP4",0.0,,,0.0,0.0,59599.0,0.0
mtserv1,"SERVICE CLUB1 MEETS IN THIS AREA",1.165,1.0,2.0,0.373,133.0,59466.0,0.139
mtserv2,"SERVICE CLUB2 MEETS IN THIS AREA",1.2,1.0,2.0,0.407,30.0,59569.0,0.166
mtserv3,"SERVICE CLUB3 MEETS IN THIS AREA",1.071,1.0,2.0,0.267,14.0,59585.0,0.071
mtserv4,"SERVICE CLUB4 MEETS IN THIS AREA",1.5,1.0,2.0,0.707,2.0,59597.0,0.5
mtserv5,"SERVICE CLUB5 MEETS IN THIS AREA",2.0,2.0,2.0,0.0,1.0,59598.0,0.0
mtserv6,"SERVICE CLUB6 MEETS IN THIS AREA",2.0,2.0,2.0,0.0,1.0,59598.0,0.0
mtserv7,"SERVICE CLUB7 MEETS IN THIS AREA",2.0,2.0,2.0,0.0,1.0,59598.0,0.0
mtserv8,"SERVICE CLUB8 MEETS IN THIS AREA",2.0,2.0,2.0,0.0,1.0,59598.0,0.0
mtvet1,"VETERAN GROUP1 MEETS IN THIS AREA",1.25,1.0,2.0,0.436,76.0,59523.0,0.19
mtvet2,"VETERAN GROUP2 MEETS IN THIS AREA",1.0,1.0,1.0,0.0,9.0,59590.0,0.0
mtvet3,"VETERAN GROUP3 MEETS IN THIS AREA",1.0,1.0,1.0,0.0,3.0,59596.0,0.0
mtvet4,"VETERAN GROUP4 MEETS IN THIS AREA",1.0,1.0,1.0,0.0,2.0,59597.0,0.0
mtvet5,"VETERAN GROUP5 MEETS IN THIS AREA",1.0,1.0,1.0,0.0,1.0,59598.0,0.0
mtpolit1,"POLITICAL CLUB1 MEETS IN THIS AREA",1.288,1.0,2.0,0.457,59.0,59540.0,0.209
mtpolit2,"POLITICAL CLUB2 MEETS IN THIS AREA",1.25,1.0,2.0,0.463,8.0,59591.0,0.214
mtpolit3,"POLITICAL CLUB3 MEETS IN THIS AREA",1.2,1.0,2.0,0.447,5.0,59594.0,0.2
mtunion1,"LABOR UNION1 MEETS IN THIS AREA",1.261,1.0,2.0,0.441,134.0,59465.0,0.194
mtunion2,"LABOR UNION2 MEETS IN THIS AREA",1.222,1.0,2.0,0.441,9.0,59590.0,0.194
mtunion3,"LABOR UNION3 MEETS IN THIS AREA",1.5,1.0,2.0,0.707,2.0,59597.0,0.5
mtunion4,"LABOR UNION4 MEETS IN THIS AREA",1.0,1.0,1.0,0.0,1.0,59598.0,0.0
mtsport1,"SPORT CLUB1 MEETS IN THIS AREA",1.145,1.0,2.0,0.352,242.0,59357.0,0.124
mtsport2,"SPORT CLUB2 MEETS IN THIS AREA",1.063,1.0,2.0,0.246,63.0,59536.0,0.06
mtsport3,"SPORT CLUB3 MEETS IN THIS AREA",1.0,1.0,1.0,0.0,19.0,59580.0,0.0
mtsport4,"SPORT CLUB4 MEETS IN THIS AREA",1.0,1.0,1.0,0.0,3.0,59596.0,0.0
mtsport5,"SPORT CLUB5 MEETS IN THIS AREA",0.0,,,0.0,0.0,59599.0,0.0
mtsport6,"SPORT CLUB6 MEETS IN THIS AREA",0.0,,,0.0,0.0,59599.0,0.0
mtyouth1,"YOUTH GROUP1 MEETS IN THIS AREA",1.131,1.0,2.0,0.339,145.0,59454.0,0.115
mtyouth2,"YOUTH GROUP2 MEETS IN THIS AREA",1.091,1.0,2.0,0.302,11.0,59588.0,0.091
mtyouth3,"YOUTH GROUP3 MEETS IN THIS AREA",1.0,1.0,1.0,0.0,2.0,59597.0,0.0
mtyouth4,"YOUTH GROUP4 MEETS IN THIS AREA",1.0,1.0,1.0,0.0,1.0,59598.0,0.0
mtyouth5,"YOUTH GROUP5 MEETS IN THIS AREA",1.0,1.0,1.0,0.0,1.0,59598.0,0.0
mtschl1,"SCHOOL SERVICE GROUP1 MEETS IN THIS AREA",1.116,1.0,2.0,0.321,199.0,59400.0,0.103
mtschl2,"SCHOOL SERVICE GROUP2 MEETS IN THIS AREA",1.111,1.0,2.0,0.323,18.0,59581.0,0.105
mtschl3,"SCHOOL SERVICE GROUP3 MEETS IN THIS AREA",1.0,1.0,1.0,0.0,4.0,59595.0,0.0
mtschl4,"SCHOOL SERVICE GROUP4 MEETS IN THIS AREA",1.0,1.0,1.0,0.0,1.0,59598.0,0.0
mthobby1,"HOBBY CLUB1 MEETS IN THIS AREA",1.24,1.0,2.0,0.429,154.0,59445.0,0.184
mthobby2,"HOBBY CLUB2 MEETS IN THIS AREA",1.316,1.0,2.0,0.478,19.0,59580.0,0.228
mthobby3,"HOBBY CLUB3 MEETS IN THIS AREA",1.333,1.0,2.0,0.516,6.0,59593.0,0.267
mtgreek1,"SCHOOL FRARTERNITY1 MEETS IN THIS AREA",1.475,1.0,2.0,0.504,59.0,59540.0,0.254
mtgreek2,"SCHOOL FRARTERNITY2 MEETS IN THIS AREA",2.0,2.0,2.0,0.0,2.0,59597.0,0.0
mtgreek3,"SCHOOL FRARTERNITY3 MEETS IN THIS AREA",0.0,,,0.0,0.0,59599.0,0.0
mtnat1,"NATIONALITY GROUP1 MEETS IN THIS AREA",1.351,1.0,2.0,0.484,37.0,59562.0,0.234
mtnat2,"NATIONALITY GROUP2 MEETS IN THIS AREA",1.0,1.0,1.0,0.0,2.0,59597.0,0.0
mtnat3,"NATIONALITY GROUP3 MEETS IN THIS AREA",0.0,,,0.0,0.0,59599.0,0.0
mtfarm1,"FARM ORGANIZATION1 MEETS IN THIS AREA",1.419,1.0,2.0,0.499,43.0,59556.0,0.249
mtfarm2,"FARM ORGANIZATION2 MEETS IN THIS AREA",1.667,1.0,2.0,0.577,3.0,59596.0,0.333
mtfarm3,"FARM ORGANIZATION3 MEETS IN THIS AREA",1.0,1.0,1.0,0.0,1.0,59598.0,0.0
mtlit1,"MILITARY GROUP1 MEETS IN THIS AREA",1.201,1.0,2.0,0.402,149.0,59450.0,0.162
mtlit2,"MILITARY GROUP2 MEETS IN THIS AREA",1.158,1.0,2.0,0.375,19.0,59580.0,0.14
mtlit3,"MILITARY GROUP3 MEETS IN THIS AREA",1.5,1.0,2.0,0.577,4.0,59595.0,0.333
mtlit4,"MILITARY GROUP4 MEETS IN THIS AREA",1.0,1.0,1.0,0.0,1.0,59598.0,0.0
mtprof1,"PROFESSIONAL SOCIETY1 MEETS IN THIS AREA",1.432,1.0,2.0,0.497,213.0,59386.0,0.247
mtprof2,"PROFESSIONAL SOCIETY2 MEETS IN THIS AREA",1.457,1.0,2.0,0.502,70.0,59529.0,0.252
mtprof3,"PROFESSIONAL SOCIETY3 MEETS IN THIS AREA",1.296,1.0,2.0,0.465,27.0,59572.0,0.217
mtprof4,"PROFESSIONAL SOCIETY4 MEETS IN THIS AREA",1.889,1.0,2.0,0.333,9.0,59590.0,0.111
mtprof5,"PROFESSIONAL SOCIETY5 MEETS IN THIS AREA",1.25,1.0,2.0,0.5,4.0,59595.0,0.25
mtprof6,"PROFESSIONAL SOCIETY6 MEETS IN THIS AREA",2.0,2.0,2.0,0.0,1.0,59598.0,0.0
mtchurh1,"CHURCH GROUP1 MEETS IN THIS AREA",1.144,1.0,2.0,0.351,438.0,59161.0,0.123
mtchurh2,"CHURCH GROUP2 MEETS IN THIS AREA",1.115,1.0,2.0,0.323,52.0,59547.0,0.104
mtchurh3,"CHURCH GROUP3 MEETS IN THIS AREA",1.105,1.0,2.0,0.315,19.0,59580.0,0.099
