Variable,Label,Mean,Min,Max,StdDev,Valid,Invalid,Variance
corrupt2,"OPINION OF CORRUPTION BY GOVERNMENT ADMINISTRATORS",3.101,1.0,5.0,0.964,1462.0,58137.0,0.93
bribe,"DOES R SEE PUBLIC OFFICIAL ASKING FOR A BRIBE IN LAST FIVE YEARS",1.194,1.0,5.0,0.587,1513.0,58086.0,0.344
peocntct,"HOW MANY PEOPLE IN CONTACT IN A TYPICAL WEEKDAY",2.79,1.0,5.0,1.275,2767.0,56832.0,1.626
malive,"MOTHER STILL ALIVE?",1.382,1.0,2.0,0.486,2861.0,56738.0,0.236
mavisit,"HOW OFTEN VISIT MOTHER",4.421,1.0,7.0,1.883,1756.0,57843.0,3.547
matime,"TRAVEL TIME TO MOTHER",3.682,1.0,8.0,2.559,787.0,58812.0,6.55
macall,"CONTACT WITH MOTHER",2.978,1.0,6.0,1.363,785.0,58814.0,1.858
palive,"FATHER STILL ALIVE?",1.528,1.0,2.0,0.499,1450.0,58149.0,0.249
pavisit,"HOW OFTEN VISIT FATHER",4.57,1.0,7.0,1.932,683.0,58916.0,3.732
patime,"TRAVEL TIME TO FATHER",3.867,1.0,8.0,2.642,615.0,58984.0,6.982
pacall,"CONTACT WITH FATHER",3.593,1.0,6.0,1.484,614.0,58985.0,2.203
sisnum,"NUMBER OF ADULT SISTERS",1.513,0.0,5.0,1.421,1463.0,58136.0,2.019
sisvisit,"HOW OFTEN VISIT SISTER",5.131,1.0,7.0,1.644,1047.0,58552.0,2.703
sistime,"TRAVEL TIME TO SISTER",4.062,1.0,8.0,2.554,1016.0,58583.0,6.521
siscall,"CONTACT WITH SISTER",3.738,1.0,6.0,1.522,1018.0,58581.0,2.316
bronum,"NUMBER OF ADULT BROTHERS",1.445,0.0,5.0,1.387,1463.0,58136.0,1.923
brovisit,"HOW OFTEN VISIT BROTHER",5.253,1.0,7.0,1.641,1033.0,58566.0,2.693
brotime,"TRAVEL TIME TO BROTHER",4.193,1.0,8.0,2.602,992.0,58607.0,6.769
brocall,"CONTACT WITH BROTHER",4.217,1.0,6.0,1.392,997.0,58602.0,1.937
daunum,"NUMBER OF ADULT DAUGHTERS",0.603,0.0,5.0,1.048,1467.0,58132.0,1.098
dauvisit,"HOW OFTEN VISIT WITH DAUGHTER",3.928,1.0,7.0,1.934,489.0,59110.0,3.739
dautime,"TRAVEL TIME TO DAUGHTER",3.535,1.0,8.0,2.478,415.0,59184.0,6.138
daucall,"CONTACT WITH DAUGHTER",2.741,1.0,6.0,1.524,417.0,59182.0,2.322
sonnum,"NUMBER OF ADULT SONS",0.635,0.0,5.0,1.099,1467.0,58132.0,1.207
sonvisit,"HOW OFTEN VISIT SON",3.829,1.0,7.0,2.077,492.0,59107.0,4.313
sontime,"TRAVEL TIME TO SON",3.845,1.0,8.0,2.613,386.0,59213.0,6.828
soncall,"CONTACT WITH SON",3.127,1.0,6.0,1.471,387.0,59212.0,2.163
posslq,"DOES R HAVE MARITAL PARTNER",2.341,1.0,4.0,1.378,8776.0,50823.0,1.898
POSSLQY,"RELATIONSHIP STATUS AND COHABITATION OR NOT",2.375,1.0,4.0,1.36,2235.0,57364.0,1.85
grparnum,"NUMBER OF GRANDPARENTS",0.532,0.0,9.0,1.005,1463.0,58136.0,1.01
grkidnum,"NUMBER OF ADULT GRANDCHILDREN",1.105,0.0,97.0,7.184,1458.0,58141.0,51.611
unaunum,"NUMBER OF AUNTS AND UNCLES",6.587,0.0,97.0,8.425,1453.0,58146.0,70.981
inlawnum,"NUMBER OF IN-LAWS",4.498,0.0,97.0,6.899,1462.0,58137.0,47.6
relnum,"NUMBER OF ADULT NIECES, NEPHEWS, ETC",19.141,0.0,97.0,21.506,1428.0,58171.0,462.518
relmost,"ADULT RELATIVE R HAS MOST CONTACT WITH",7.964,1.0,13.0,3.474,1464.0,58135.0,12.072
relvisit,"HOW OFTEN VISIT MOST CONTACTED REL",4.554,1.0,7.0,1.604,1329.0,58270.0,2.574
reltime,"TRAVEL TIME TO MOST CONTACTED REL",3.225,1.0,8.0,2.368,1289.0,58310.0,5.606
relcall,"CONTACT WITH MOST CONTACTED REL",3.591,1.0,6.0,1.493,1290.0,58309.0,2.228
frinum,"NUMBER OF CLOSE FRIENDS",7.443,0.0,96.0,10.98,1467.0,58132.0,120.57
friwork,"NUMBER OF CLOSE FRIENDS ARE COWORKERS",0.94,0.0,30.0,2.473,1378.0,58221.0,6.116
frineigh,"NUMBER OF CLOSE FRIENDS ARE NEIGHBORS",1.477,0.0,96.0,4.078,1381.0,58218.0,16.628
frisex,"SEX OF CLOSEST FRIEND",1.579,1.0,2.0,0.494,1381.0,58218.0,0.244
frivisit,"HOW OFTEN VISIT CLOSEST FRIEND",3.953,1.0,7.0,1.502,1383.0,58216.0,2.256
fritime,"TRAVEL TIME TO CLOSEST FRIEND",2.337,1.0,8.0,1.892,1366.0,58233.0,3.579
fricall,"CONTACT WITH CLOSEST FRIEND",2.997,1.0,6.0,1.575,1366.0,58233.0,2.479
chores1,"HELP FOR HOUSEHOLD TASKS #1",4.124,1.0,16.0,3.906,1409.0,58190.0,15.259
chores2,"HELP FOR HOUSEHOLD TASKS #2",7.585,1.0,16.0,3.655,1399.0,58200.0,13.359
sick1,"HELP IF SICK #1",3.499,1.0,17.0,3.617,1408.0,58191.0,13.08
sick2,"HELP IF SICK #2",6.931,1.0,17.0,3.644,1396.0,58203.0,13.278
borrow1,"BORROW MONEY #1",8.06,1.0,17.0,5.214,1401.0,58198.0,27.191
borrow2,"BORROW MONEY #2",9.092,1.0,17.0,4.892,1382.0,58217.0,23.934
upset1,"HELP FOR MARITAL PROBLEM #1",7.881,1.0,17.0,4.51,1397.0,58202.0,20.343
upset2,"HELP FOR MARITAL PROBLEM #2",9.329,1.0,17.0,4.467,1378.0,58221.0,19.951
down1,"HELP FOR DEPRESSION #1",5.348,1.0,17.0,4.533,1417.0,58182.0,20.548
down2,"HELP FOR DEPRESSION #2",7.959,1.0,17.0,4.154,1403.0,58196.0,17.256
change1,"HELP REGARDING IMPORTANT CHANGE #1",4.19,1.0,18.0,4.522,1413.0,58186.0,20.447
change2,"HELP REGARDING IMPORTANT CHANGE #2",7.112,1.0,18.0,4.387,1390.0,58209.0,19.247
livecom,"LENGTH OF RESIDENCE IN CITY, TOWN, COMM",20.416,0.0,89.0,18.365,1415.0,58184.0,337.259
livehome,"LENGTH AT PRESENT DWELLING",10.466,0.0,83.0,12.323,1421.0,58178.0,151.849
matime1,"HOW LONG DOES IT TAKE TO GET TO WHERE MOTHER LIVE",4.572,1.0,9.0,2.68,676.0,58923.0,7.184
sibnum,"NUMBER OF ADULT SISTER OR BROTHER",2.788,0.0,19.0,2.385,1149.0,58450.0,5.69
sibmost,"DO R HAVE THE MOST CONTACT WITH SISTER OR BROTHER",1.647,1.0,3.0,0.586,1009.0,58590.0,0.344
sibvisit,"HOW OFTEN DOES R VISIT THIS SISTER OR BROTHER",4.927,1.0,7.0,1.651,951.0,58648.0,2.724
sibcall,"HOW OFTEN DOES R CONTACT BY TELEPHONE OR LETTER",3.345,1.0,6.0,1.483,925.0,58674.0,2.198
kidnum,"NUMBER OF CHILDREN AGE 18 AND OLDER",1.08,0.0,9.0,1.65,1168.0,58431.0,2.723
kidmost,"DO R HAVE THE MOST CONTACT WITH SON OR DAUGHTER",1.62,1.0,3.0,0.526,447.0,59152.0,0.277
kidvisit,"HOW OFTEN DOES R VISIT THIS SON OR DAUGHTER",3.571,1.0,7.0,1.84,438.0,59161.0,3.385
kidcall,"HOW OFTEN DOES R CONTACT BY TELEPHONE OR LETTER",2.521,1.0,6.0,1.38,359.0,59240.0,1.904
pavisit1,"HOW OFTEN DOES R VISIT FATHER",6.993,1.0,10.0,2.473,1145.0,58454.0,6.117
pacall1,"HOW OFTEN DOES R CONTACT FATHER BY TELEPHONE",3.835,1.0,7.0,1.887,540.0,59059.0,3.559
mavisit1,"HOW OFTEN DOES R VISIT MOTHER",5.948,1.0,10.0,2.706,1145.0,58454.0,7.324
macall1,"HOW OFTEN DOES R CONTACT MOTHER BY TELEPHONE",2.953,1.0,7.0,1.619,678.0,58921.0,2.621
uncaunts,"HOW OFTEN DOES R CONTACT UNCLES OR AUNTS",2.591,1.0,4.0,0.952,1143.0,58456.0,0.906
cousins,"HOW OFTEN DOES R CONTACT COUSIN",2.405,1.0,4.0,0.855,1142.0,58457.0,0.73
parslaw,"HOW OFTEN DOES R CONTACT PARENTS-IN-LAW",2.972,1.0,4.0,1.18,1140.0,58459.0,1.393
sibinlaw,"HOW OFTEN DOES R CONTACT BROTHERS OR SISTERS-IN-LAW",2.419,1.0,4.0,1.104,1140.0,58459.0,1.218
niecenep,"HOW OFTEN DOES R CONTACT NIECES AND NEPHEWS",2.271,1.0,4.0,1.051,1140.0,58459.0,1.104
godparts,"HOW OFTEN DOES R CONTACT GOD-PARENTS",3.543,1.0,4.0,0.743,1134.0,58465.0,0.552
cowrkfrd,"NUMBER OF CLOSE FRIENDS AT WORK PLACE",2.758,0.0,30.0,3.648,756.0,58843.0,13.307
neifrd,"NUMBER OF CLOSE FRIENDS WHO LIVE NEAR R",3.172,0.0,50.0,4.85,1142.0,58457.0,23.522
bestfrd,"NUMBER OF OTHER CLOSE FRIENDS",3.038,1.0,5.0,1.121,1140.0,58459.0,1.257
bstvisit,"HOW OFTEN DOES R VISIT BEST FRIEND",4.301,1.0,8.0,1.592,1083.0,58516.0,2.536
bstcall,"HOW OFTEN DOES R CALL BEST FRIEND",2.986,1.0,7.0,1.592,1057.0,58542.0,2.535
grppol,"PARTICIPATED IN ACTIVITY OF POLITICAL PARTY",3.462,1.0,4.0,1.009,1141.0,58458.0,1.019
grpunion,"PARTICIPATED IN ACTIVITY OF A TRADE UNION",3.505,1.0,4.0,0.966,1141.0,58458.0,0.933
grpchurh,"PARTICIPATED IN ACTIVITY OF CHURCH PAST 12 MONTHS",2.468,1.0,4.0,1.313,1142.0,58457.0,1.725
grpsport,"PARTICIPATED IN SPORTS GROUP PAST 12 MONTHS",2.977,1.0,4.0,1.332,1142.0,58457.0,1.775
grpchrty,"PARTICIPATED IN A CHARITABLE ORG PAST 12 MONTHS",3.195,1.0,4.0,1.193,1141.0,58458.0,1.422
grpnei,"PARTICIPATED IN A NEIGHBOR ASSOCIATION PAST 12 MONTHS",3.564,1.0,4.0,0.926,1142.0,58457.0,0.858
grpoth,"PARTICIPATED IN OTHER ASSOCIATIONS PAST 12 MONTHS",3.317,1.0,4.0,1.13,1142.0,58457.0,1.277
sick1a,"WHO DOES R TURN TO FIRST FOR HELP WHEN SICK",4.399,1.0,18.0,4.815,1142.0,58457.0,23.188
sick2a,"WHO DOES R TURN TO SECOND FOR HELP WHEN SICK",7.477,1.0,18.0,4.917,1133.0,58466.0,24.177
borrow1a,"WHO DOES R TURN TO FIRST WHEN LARGE MONEY NEEDED",7.946,1.0,19.0,6.645,1130.0,58469.0,44.152
borrow2a,"WHO DOES R TURN TO SECOND WHEN LARGE MONEY NEEDED",9.983,1.0,19.0,6.553,1130.0,58469.0,42.939
down1a,"WHO DOES R TURN TO FIRST FOR HELP WHEN DEPRESSED",6.179,1.0,18.0,5.045,1139.0,58460.0,25.449
down2a,"WHO DOES R TURN TO SECOND FOR HELP WHEN DEPRESSED",7.495,1.0,18.0,4.972,1137.0,58462.0,24.72
helphwrk,"HELPED SOMEONE WITH HWORK DURING PAST 12 MONTHS",4.079,1.0,6.0,1.53,5042.0,54557.0,2.342
lentto,"LENT MONEY TO ANOTHER PERSON PAST 12 MONTHS",5.124,1.0,6.0,1.132,5042.0,54557.0,1.281
talkedto,"TALKED WITH SOMEONE DEPRESSED PAST 12 MONTHS",3.231,1.0,6.0,1.428,5043.0,54556.0,2.038
helpjob,"HELPED SOMEBODY TO FIND A JOB PAST 12 MONTHS",4.833,1.0,6.0,1.24,5047.0,54552.0,1.538
learnjob,"HOW DID R FIND OUT ABOUT PRESENT WORK",6.823,1.0,11.0,3.041,1095.0,58504.0,9.248
frdthink,"SHOULD CLOSE FRIEND BE SOMEONE INTELLIGENT",2.34,1.0,5.0,1.045,1137.0,58462.0,1.093
frdhelps,"SHOULD CLOSE FRIEND BE SOMEONE WHO HELPS R",2.658,1.0,5.0,1.092,1139.0,58460.0,1.193
frdknows,"SHOULD CLOSE FRIEND BE SOMEONE WHO UNDERSTANDS R",1.97,1.0,5.0,0.944,1139.0,58460.0,0.892
frdenjoy,"SHOULD CLOSE FRIEND BE SOMEONE WHO IS ENJOYABLE",1.649,1.0,5.0,0.731,1141.0,58458.0,0.535
kidpars,"DO ADULT CHILDREN HAVE DUTY TO LOOK AFTER PARENT",2.022,1.0,5.0,1.009,1125.0,58474.0,1.018
firstyou,"SHOULD TAKE CARE OF ONESELF AND ONES FAMILY FIRST",1.774,1.0,5.0,0.824,1139.0,58460.0,0.679
helpfrds,"SHOULD BETTER OFF PPL HELP LESS WELL-OFF FRIEND",2.336,1.0,5.0,0.873,1116.0,58483.0,0.761
usefrds,"OK TO HAVE FRDS JUST BC THEY ARE OF USE TO R",3.829,1.0,5.0,1.005,1127.0,58472.0,1.011
aidkids,"GOVTS RESP PROVIDE CHILDCARE",2.772,1.0,4.0,1.034,1043.0,58556.0,1.069
othfrd,"NUMBER OF OTHER CLOSE FRIENDS",7.911,0.0,75.0,10.622,1135.0,58464.0,112.824
demands,"R FEELS THAT FAMILY MAKE TOO MANY DEMANDS ON R",1.96,1.0,5.0,1.041,1136.0,58463.0,1.084
trustpeo,"THERE ARE ONLY A FEW PPL R CAN TRUST COMPLETELY",1.937,1.0,5.0,1.003,1131.0,58468.0,1.006
wantbest,"R IS SURE THAT OTHER PPL WANT THE BEST FOR R",2.398,1.0,5.0,0.942,1124.0,58475.0,0.888
advantge,"OTHER PPL WILL TAKE ADVANTAGE OF R IF NOT CAREFUL",2.197,1.0,5.0,0.986,1129.0,58470.0,0.972
comyear,"HOW LONG HAS R LIVED IN CITY WHERE R LIVES NOW",1979.789,1905.0,2001.0,19.263,1130.0,58469.0,371.047
localgvt,"HOW LIKELY CAN R DO STH FOR IMPROVMNT IN COMMUNITY",2.642,1.0,4.0,0.879,1060.0,58539.0,0.772
opwlth,"NEED WEALTHY FAMILY TO GET AHEAD",3.401,1.0,5.0,1.075,2690.0,56909.0,1.155
oppared,"NEED EDUCATED PARENTS TO GET AHEAD",2.757,1.0,5.0,0.954,1533.0,58066.0,0.91
opeduc,"NEED GOOD EDUCATION TO GET AHEAD",1.809,1.0,5.0,0.715,1542.0,58057.0,0.512
opambit,"NEED AMBITION TO GET AHEAD",1.72,1.0,5.0,0.703,1530.0,58069.0,0.494
opable,"NEED NATURAL ABILITY TO GET AHEAD",2.286,1.0,5.0,0.759,1529.0,58070.0,0.576
ophrdwrk,"NEED TO WORK HARD TO GET AHEAD",1.757,1.0,5.0,0.694,1547.0,58052.0,0.482
opknow,"NEED TO KNOW RIGHT PEOPLE TO GET AHEAD",2.599,1.0,5.0,0.911,2736.0,56863.0,0.83
opclout,"NEED POLITICAL CONNECTIONS TO GET AHEAD",3.401,1.0,5.0,1.033,1485.0,58114.0,1.068
oprace,"NEED TO BE RIGHT RACE TO GET AHEAD",3.608,1.0,5.0,1.091,1498.0,58101.0,1.19
oprelig,"NEED TO BE RIGHT RELIGION TO GET AHEAD",3.795,1.0,5.0,1.18,1508.0,58091.0,1.392
opregion,"MUST BE FROM RIGHT REGION TO GET AHEAD",4.022,1.0,5.0,0.992,1510.0,58089.0,0.985
opsex,"NEED TO BE RIGHT SEX TO GET AHEAD",3.682,1.0,5.0,1.116,1494.0,58105.0,1.244
oppol,"MUST HAVE CERTAIN POLVIEWS TO GET AHEAD",3.752,1.0,5.0,1.004,1486.0,58113.0,1.008
goodlife,"STANDARD OF LIVING OF R WILL IMPROVE",2.409,1.0,5.0,1.059,18127.0,41472.0,1.12
incentiv,"PAY DIFFERENCES NEEDED FOR MOTIVATION",2.132,1.0,4.0,0.814,1459.0,58140.0,0.662
inequal1,"EXTRA PAY -> PEOPLE TAKE RESPONSIBILITY",2.168,1.0,5.0,1.074,2941.0,56658.0,1.153
inequal2,"EXTRA PAY -> WORKERS ACQUIRE SKILLS",2.578,1.0,5.0,1.106,1506.0,58093.0,1.224
inequal3,"INEQUALITY EXISTS FOR BENEFIT OF RICH",2.545,1.0,5.0,1.15,4909.0,54690.0,1.322
inequal4,"EXTRA PAY -> PEOPLE EARN DEGREES",2.323,1.0,5.0,1.123,2706.0,56893.0,1.261
inequal5,"PAY DIFFERENCES -> AMERICAN PROSPERITY",3.268,1.0,5.0,1.138,4995.0,54604.0,1.294
inequal6,"EVERYONE BENEFITS FROM BUSINESS PROFITS",2.713,1.0,5.0,1.183,2860.0,56739.0,1.4
inequal7,"INEQUALITY DUE TO LACK OF SOLIDARITY",2.725,1.0,5.0,1.065,2592.0,57007.0,1.135
paymason,"HOW MUCH R THINKS BRICKLAYER MAKES",28932.131,1000.0,999996.0,30055.425,1309.0,58290.0,903328565.287
paydoc,"HOW MUCH R THINKS DOCTOR MAKES",116110.508,15.0,999996.0,109823.854,2374.0,57225.0,12061278806.765
payclerk,"HOW MUCH R THINKS BANK CLERK MAKES",18928.915,1000.0,999996.0,28949.014,1312.0,58287.0,838045438.681
payowner,"HOW MUCH R THINKS SHOP OWNER MAKES",28852.758,1000.0,250000.0,19489.439,1280.0,58319.0,379838228.12
payexec,"HOW MUCH R THINKS CORPORATE HEAD MAKES",302743.506,1000.0,999996.0,325857.692,2328.0,57271.0,106183235410.605
payskill,"HOW MUCH R THINKS SKILLED WORKER MAKES",29310.341,1000.0,999996.0,30532.231,2367.0,57232.0,932217107.659
payfarm,"HOW MUCH R THINKS FARM WORKER MAKES",15397.786,0.0,900000.0,26645.17,1315.0,58284.0,709965082.587
paysec,"HOW MUCH R THINKS SECRETARY MAKES",17170.308,1000.0,999996.0,28439.385,1315.0,58284.0,808798638.274
paybus,"HOW MUCH R THINKS BUS DRIVER MAKES",20390.05,1800.0,999996.0,28361.135,1303.0,58296.0,804353951.623
payunskl,"HOW MUCH R THINKS UNSKILLED WRKR MAKES",17732.023,6.0,999996.0,32478.684,2363.0,57236.0,1054864918.687
paycabnt,"HOW MUCH R THINKS CABINET MEMBER MAKES",106329.662,400.0,999996.0,103772.071,2311.0,57288.0,10768642778.293
paylaw,"HOW MUCH R THINKS LAWYERS MAKE",157413.49,1000.0,999996.0,158580.207,1047.0,58552.0,25147681983.338
paysales,"HOW MUCH R THINKS SALESCLERKS MAKE",21282.061,300.0,999996.0,32079.754,1046.0,58553.0,1029110637.524
payfctry,"HOW MUCH R THINKS OWNER OF A LARGE FACTORY MAKES",218614.004,300.0,999996.0,271530.972,1037.0,58562.0,73729068805.066
payjudge,"HOW MUCH R THINKS SUPREME COURT JUSTICE MAKES",149344.101,520.0,999996.0,139546.983,1033.0,58566.0,19473360571.711
payrocc,"HOW MUCH R THINKS WORKERS IN OWN OCCUPATION MAKE",58820.025,1000.0,999997.0,140284.907,1038.0,58561.0,19679855021.131
givmason,"HOW MUCH OUGHT MASON MAKE?",31906.317,1000.0,999996.0,51986.4,1257.0,58342.0,2702585788.197
givdoc,"HOW MUCH OUGHT DOCTOR MAKE?",101873.762,1500.0,999996.0,93167.858,2276.0,57323.0,8680249798.639
givclerk,"HOW MUCH OUGHT BANK CLERK MAKE?",22385.851,1000.0,999994.0,49814.418,1268.0,58331.0,2481476195.186
givowner,"HOW MUCH OUGHT SHOP OWNER MAKE?",98014.335,1000.0,999996.0,172786.583,2224.0,57375.0,29855203422.286
givexec,"HOW MUCH OUGHT CORPORATE HEAD MAKE?",181463.626,200.0,999996.0,231346.751,2247.0,57352.0,53521319142.678
givskill,"HOW MUCH OUGHT SKILLED WORKER MAKE?",35272.034,1000.0,999996.0,53625.369,2276.0,57323.0,2875680242.497
givfarm,"HOW MUCH OUGHT FARM WORKER MAKE?",23265.959,1000.0,999993.0,50933.484,1261.0,58338.0,2594219830.119
givsec,"HOW MUCH OUGHT SECRETARY MAKE?",22826.463,1000.0,999994.0,56949.445,1267.0,58332.0,3243239337.024
givbus,"HOW MUCH OUGHT BUS DRIVER MAKE?",24330.511,1000.0,999994.0,57029.742,1260.0,58339.0,3252391444.447
givunskl,"HOW MUCH OUGHT UNSKILLED WORKER MAKE?",23063.006,0.0,999996.0,48946.495,2272.0,57327.0,2395759351.292
givcabnt,"HOW MUCH OUGHT CABINET MEMBER MAKE?",81023.463,0.0,999996.0,84832.215,2230.0,57369.0,7196504651.743
givlaw,"HOW MUCH OUGHT LAWYER MAKE",114963.529,520.0,999996.0,117989.132,997.0,58602.0,13921435338.207
givsales,"HOW MUCH OUGHT SALESCLERK MAKE",27790.78,500.0,999996.0,34933.758,1008.0,58591.0,1220367480.857
givfctry,"HOW MUCH OUGHT OWNER OF A LARGE FACTORY MAKES",55000.0,55000.0,55000.0,0.0,1.0,59598.0,0.0
givjudge,"HOW MUCH OUGHT JUSTICE MAKE",129982.171,1.0,999996.0,124240.869,991.0,58608.0,15435793452.558
givrocc,"HOW MUCH OUGHT WORKER IN OWN OCCUPATION MAKE",68266.739,520.0,999997.0,144934.827,1009.0,58590.0,21006104202.875
incgap,"INCOME DIFFERENTIALS IN USA TOO BIG",2.334,1.0,5.0,1.118,5099.0,54500.0,1.25
goveqinc,"GOVMNT SHOULD REDUCE INC DIFFERENTIALS",3.206,1.0,5.0,1.217,10242.0,49357.0,1.481
govedop,"GOVMNT SHOULD HELP POOR ATTEND COLLEGE",2.068,1.0,5.0,0.936,1523.0,58076.0,0.876
govjobs,"GOVMNT SHOULD PROVIDE JOBS",2.73,1.0,5.0,1.221,1509.0,58090.0,1.492
govless,"GOVMNT SHOULD SPEND LESS ON POOR",3.606,1.0,5.0,1.041,1496.0,58103.0,1.083
govunemp,"GOVMNT SHOULD PROVIDE UNEMP BENEFITS",2.853,1.0,5.0,1.072,1495.0,58104.0,1.148
govminc,"GOVMNT SHOULD PROVIDE MINIMUM INCOME",3.364,1.0,5.0,1.156,1483.0,58116.0,1.337
taxrich,"TAXES ON HIGH INCOME PEOPLE TOO HIGH",3.277,1.0,5.0,1.195,5071.0,54528.0,1.429
taxmid,"TAXES ON MIDDLE INCOME PEOPLE TOO HIGH",2.233,1.0,5.0,0.756,4193.0,55406.0,0.572
taxpoor,"TAXES ON LOW INCOME PEOPLE TOO HIGH",2.115,1.0,5.0,0.891,4129.0,55470.0,0.794
taxshare,"SHOULD RICH PAY BIGGER SHARE OF TAXES?",2.156,1.0,5.0,0.8,3644.0,55955.0,0.641
conwlth,"CONFLICT BETWEEN POOR AND RICH IN USA?",2.252,1.0,4.0,0.771,2536.0,57063.0,0.594
conclass,"WORKING AND MIDDLE CLASSES IN CONFLICT?",2.795,1.0,4.0,0.696,2538.0,57061.0,0.485
conjobs,"EMPLOYED AND UNEMPLOYED IN CONFLICT",2.448,1.0,4.0,0.793,1442.0,58157.0,0.629
conunion,"WORKERS AND MANAGEMENT IN CONFLICT?",2.348,1.0,4.0,0.733,2535.0,57064.0,0.537
conurban,"FARMERS AND CITY PEOPLE IN CONFLICT?",2.634,1.0,4.0,0.826,1425.0,58174.0,0.682
consoc,"CONFLICT BETWEEN SOCIAL TOP AND BOTTOM",2.013,1.0,4.0,0.816,1091.0,58508.0,0.666
conage,"CONFLICT BETWEEN YOUNG AND OLD",2.534,1.0,4.0,0.778,1107.0,58492.0,0.605
occmobil,"STATUS OF JOB HIGHER THAN FATHERS?",2.903,1.0,7.0,1.585,2636.0,56963.0,2.512
pajob,"TYPE OF JOB HELD BY FATHER WHEN R 16",5.922,1.0,9.0,2.552,1376.0,58223.0,6.512
paslf,"WAS FATHER SELF-EMPLOYED?",1.791,1.0,3.0,0.536,1376.0,58223.0,0.288
firstjob,"TYPE OF FIRST JOB HELD BY R",5.154,1.0,10.0,2.754,1458.0,58141.0,7.584
firstslf,"FIRST JOB SELF-EMPLOYMENT?",1.999,1.0,3.0,0.287,1364.0,58235.0,0.082
lastjob,"TYPE OF CURRENT JOB HELD BY R",4.63,1.0,10.0,2.588,1458.0,58141.0,6.696
lastslf,"CURRENT JOB SELF-EMPLOYMENT?",1.929,1.0,3.0,0.365,1365.0,58234.0,0.134
rewrdeff,"EFFORT REWARDED IN AMERICA",2.381,1.0,5.0,0.89,1193.0,58406.0,0.791
rewrdint,"INTELLIGENCE AND SKILL REWARDED IN AMERICA",2.21,1.0,5.0,0.845,1198.0,58401.0,0.714
corrupt,"MUST BE CORRUPT TO GET TO TOP IN AMERICA",3.607,1.0,5.0,1.103,1193.0,58406.0,1.217
earndes,"R DESERVES EARNINGS",2.327,1.0,6.0,0.906,1121.0,58478.0,0.82
ldcgap,"DIFFERENCES BETWEEN RICH AND POOR TOO LARGE",2.224,1.0,5.0,0.885,1145.0,58454.0,0.783
ldctax,"RICH COUNTRIES PAY TAX TO HELP POOR COUNTRIES",3.009,1.0,5.0,1.206,1168.0,58431.0,1.455
richhlth,"RICH BUY BETTER HEALTH CARE THAN POOR",3.361,1.0,5.0,1.387,1188.0,58411.0,1.924
richeduc,"RICH BUY BETTER EDUCATION THAN POOR",3.3,1.0,5.0,1.416,1196.0,58403.0,2.006
payresp,"HOW MUCH PAY DEPENDENT ON REPONSIBILITY",1.9,1.0,5.0,0.718,1188.0,58411.0,0.515
payedtrn,"HOW MUCH PAY DEPENDENT ON EDUC AND TRAINING",2.14,1.0,5.0,0.824,1199.0,58400.0,0.678
paysup,"HOW MUCH PAY DEPENDENT ON SUPERVISING OTHERS",2.277,1.0,5.0,0.816,1184.0,58415.0,0.665
payfam1,"HOW MUCH PAY DEPENDENT ON FAMILY TO SUPPORT",2.353,1.0,5.0,1.068,1179.0,58420.0,1.14
paychild,"HOW MUCH PAY DEPENDENT ON CHILDREN",2.862,1.0,5.0,1.233,1164.0,58435.0,1.519
paydowel,"HOW MUCH PAY DEPENDENT ON WORK WELL DONE",1.698,1.0,5.0,0.678,1201.0,58398.0,0.459
payhard,"HOW MUCH PAY DEPENDENT ON WORKING HARD",1.767,1.0,5.0,0.707,1198.0,58401.0,0.5
justpay,"IS RS PAY JUST",2.321,1.0,6.0,0.983,1142.0,58457.0,0.967
soctype1,"WHAT TYPE OF SOCIETY IS AMERICA",2.676,1.0,5.0,1.143,1124.0,58475.0,1.307
soctype2,"WHAT TYPE OF SOCIETY DOES R PREFER",3.839,1.0,5.0,0.986,1098.0,58501.0,0.972
famrnk,"RANK IN SOCIETY OF R",4.217,1.0,7.0,1.184,1135.0,58464.0,1.401
unsklrnk,"RANK IN SOCIETY OF UNSKILLED WORKERS",5.73,1.0,7.0,1.142,1131.0,58468.0,1.303
execrnk,"RANK IN SOCIETY OF CHAIRMEN",1.769,1.0,7.0,0.99,1117.0,58482.0,0.981
pasup,"RS FATHER SUPERVISOR",2.247,1.0,5.0,1.253,1199.0,58400.0,1.57
books16,"BOOKS IN HOME OF R AGE 16",4.798,1.0,9.0,1.862,1199.0,58400.0,3.468
mawrkwrm,"WORKING MOM CAN HAVE A WARM REL W KIDS",2.229,1.0,5.0,1.256,5250.0,54349.0,1.577
kidsuffr,"PRESCHOOLER WILL SUFFER IF MOM WORKS",3.219,1.0,5.0,1.314,5225.0,54374.0,1.727
famsuffr,"FAMILY LIFE SUFFERS IF MOM WORKS F-T",3.274,1.0,5.0,1.297,7758.0,51841.0,1.683
hapifwrk,"WOMAN AND FAMILY HAPPIER IF SHE WORKS",3.346,1.0,5.0,0.954,1340.0,58259.0,0.911
homekid,"MOST WOMEN REALLY WANT A HOME AND KIDS",3.106,1.0,5.0,1.211,5110.0,54489.0,1.466
housewrk,"BEING HOUSEWIFE AS FULFILLING AS PAID WORK",2.525,1.0,5.0,1.172,5068.0,54531.0,1.373
fejobind,"JOB IS BEST WAY FOR WOMAN TO BE INDEP",2.779,1.0,5.0,1.222,3915.0,55684.0,1.492
twoincs,"HUSB & WIFE SHOULD CONTRIB TO FAMILY INCOME",2.358,1.0,5.0,1.02,4190.0,55409.0,1.041
hubbywrk,"HUSB SHLD WORK WIFE SHLD LOOK AFTER HOME",3.396,1.0,5.0,1.292,5280.0,54319.0,1.669
ilikejob,"R WOULD ENJOY JOB IF MONEY WASNT NEEDED",2.522,1.0,5.0,1.151,1359.0,58240.0,1.325
wrknokid,"SHLD MOM WORK AFTR MARRIAGE, BEFORE KIDS?",1.229,1.0,3.0,0.496,3466.0,56133.0,0.246
wrkbaby,"SHLD WOMAN WITH PRESCHOOLER WORK?",2.352,1.0,3.0,0.697,4516.0,55083.0,0.486
wrksch,"SHLD WOMAN WORK AFTER YOUNGEST IN SCHOOL?",1.666,1.0,3.0,0.623,4545.0,55054.0,0.388
wrkgrown,"SHLD WOMAN WORK AFTER KIDS LEAVE HOME?",1.262,1.0,3.0,0.514,3371.0,56228.0,0.264
daycare1,"PUBLIC DAYCARE CENTER OK FOR KID < 3 YRS?",2.271,1.0,4.0,0.941,1258.0,58341.0,0.885
daycare2,"PRIVATE DAYCARE CENTER OK FOR KID < 3 YRS?",1.894,1.0,4.0,0.843,1270.0,58329.0,0.711
daycare3,"BABYSITTER OK FOR KID < 3 YRS?",2.007,1.0,4.0,0.853,1280.0,58319.0,0.728
daycare4,"FRIEND OR NEIGHBOR OK FOR KID < 3 YRS?",2.016,1.0,4.0,0.85,1278.0,58321.0,0.723
daycare5,"RELATIVE OK FOR KID < 3YRS?",1.6,1.0,4.0,0.759,1315.0,58284.0,0.577
femarry,"WAY OF LIFE RECOMMENDATION FOR WOMAN",3.296,1.0,4.0,0.965,1192.0,58407.0,0.931
memarry,"WAY OF LIFE RECOMMENDATION FOR MAN",3.261,1.0,4.0,0.992,1188.0,58411.0,0.983
marhappy,"MARRIED PEOPLE HAPPIER THAN UNMARRIED",2.705,1.0,5.0,1.069,5076.0,54523.0,1.143
marfree,"PERSONAL FREEDOM MORE IMPT THAN MARRIAGE",3.61,1.0,5.0,1.019,2771.0,56828.0,1.039
marfin,"FINANCIAL SECURITY MAIN ADVTG OF MARRIAGE",3.569,1.0,5.0,1.004,2770.0,56829.0,1.008
markids,"MAIN PURPOSE OF MARRIAGE = KIDS",3.719,1.0,5.0,0.928,2761.0,56838.0,0.86
marnomar,"BAD MARRIAGE BETTER THAN NONE AT ALL",4.356,1.0,5.0,0.834,3931.0,55668.0,0.695
marlegit,"THOSE WANTING KIDS SHOULD GET MARRIED",2.219,1.0,5.0,1.142,5212.0,54387.0,1.304
marmakid,"SINGLE MA CAN RAISE KIDS WELL AS COUPLE",3.116,1.0,5.0,1.187,1375.0,58224.0,1.408
marpakid,"SINGLE PA CAN RAISE KIDS WELL AS COUPLE",3.234,1.0,5.0,1.157,1370.0,58229.0,1.34
mardiv,"MARRIAGE NOT TAKEN SERIOUSLY WHEN DIV IS EZ",2.341,1.0,5.0,1.071,1365.0,58234.0,1.147
marhomo,"HOMOSEXUALS SHOULD HAVE RIGHT TO MARRY",3.217,1.0,5.0,1.516,10048.0,49551.0,2.3
numkids,"WHAT IS IDEAL NUMBER OF KIDS FOR FAMILY",2.557,0.0,7.0,0.927,3830.0,55769.0,0.859
nokids,"DESIRABILITY OF NO-KID FAMILY",3.342,1.0,5.0,1.012,1221.0,58378.0,1.025
onekid,"DESIRABILITY OF ONE-KID FAMILY",2.626,1.0,5.0,0.962,1258.0,58341.0,0.925
twokids,"DESIRABILITY OF TWO-KID FAMILY",1.934,1.0,5.0,0.769,1298.0,58301.0,0.591
threkids,"DESIRABILITY OF THREE-KID FAMILY",2.374,1.0,5.0,0.983,1281.0,58318.0,0.966
fourkids,"DESIRABILITY OF 4+ KID FAMILY",2.992,1.0,5.0,1.214,1259.0,58340.0,1.474
kidtrble,"KIDS MORE TROUBLE THAN THEY ARE WORTH",4.279,1.0,5.0,0.844,1377.0,58222.0,0.713
kidjoy,"KIDS ARE LIFE'S GREATEST JOY",1.761,1.0,5.0,0.817,5186.0,54413.0,0.668
kidnofre,"KIDS INTERFERE WITH PARENTS' FREEDOM",3.842,1.0,5.0,0.944,4001.0,55598.0,0.892
kidless,"KIDLESS MARRIAGE IS INCOMPLETE",2.771,1.0,5.0,1.17,1354.0,58245.0,1.37
kidfin,"BETTER NOT TO HAVE KIDS DUE TO $ BURDEN",4.169,1.0,5.0,0.817,1376.0,58223.0,0.667
kidempty,"KIDLESS PEOPLE LEAD EMPTY LIVES",3.407,1.0,5.0,1.118,3837.0,55762.0,1.25
divnow,"HOW EASY IS IT TO GET A DIVORCE TODAY",1.948,1.0,5.0,1.071,1339.0,58260.0,1.146
divnokid,"HOW EZ SHOULD DIVORCE BE FOR KIDLESS",2.793,1.0,5.0,1.209,1305.0,58294.0,1.462
divifkid,"HOW EZ SHOULD DIVORCE BE IF KIDS",3.584,1.0,5.0,1.102,1311.0,58288.0,1.214
divkids,"KIDS BETTER IF BAD MARRGE ENDED BY DIV",2.155,1.0,4.0,0.878,1073.0,58526.0,0.771
divwife,"WIFE BETTER IF BAD MARRGE ENDED BY DIV",2.112,1.0,4.0,0.834,1058.0,58541.0,0.696
divhubby,"HUSB BETTER IF BAD MARRGE ENDED BY DIV",2.092,1.0,4.0,0.818,1061.0,58538.0,0.669
mawork14,"DID MOM WORK BEFORE R WAS 14 YRS OLD",1.446,1.0,3.0,0.528,5181.0,54418.0,0.279
evdiv,"HAS R EVER BEEN DIVORCED",1.887,1.0,3.0,0.649,2816.0,56783.0,0.422
spevdiv,"HAS RS CURRENT SPOUSE BEEN DIVORCED",2.07,1.0,3.0,0.625,2382.0,57217.0,0.391
cohabit,"DID R LIVE WITH SPOUSE BEFORE MARRIAGE",1.736,1.0,2.0,0.441,1473.0,58126.0,0.194
rwrknokd,"DID R WORK AFTR MARRGE BUT BEFORE KIDS",1.356,1.0,3.0,0.712,2072.0,57527.0,0.507
rwrkbaby,"DID R WORK WHEN KID WAS PRESCHOOLER",1.755,1.0,3.0,0.886,2089.0,57510.0,0.785
rwrksch,"DID R WORK AFTER YOUNGEST IN SCHOOL",1.507,1.0,3.0,0.763,1824.0,57775.0,0.583
rwrkgrwn,"DID R WORK AFTER KIDS LEFT HOME",1.367,1.0,3.0,0.689,1252.0,58347.0,0.475
earnsmor,"HUBBY OR WIFE EARNS MORE $",1.868,1.0,5.0,1.182,758.0,58841.0,1.396
fewrksup,"DO MOST WOMEN WORK TO SUPPORT FAMILY",1.955,1.0,5.0,0.847,1423.0,58176.0,0.717
hubbywk1,"MEN SHOULD EARN MONEY WOMEN KEEP HOUSE",3.583,1.0,5.0,1.237,3848.0,55751.0,1.53
mrmom,"GENDER ROLE REVERSAL HURTS FAMILY",3.412,1.0,5.0,1.146,1405.0,58194.0,1.314
meovrwrk,"MEN HURT FAMILY WHEN FOCUS ON WORK TOO MUCH",2.593,1.0,5.0,1.049,14119.0,45480.0,1.1
singlpar,"SINGLE PARENTS CAN RAISE KIDS AS WELL AS TWO",3.039,1.0,5.0,1.254,3843.0,55756.0,1.573
cohabok,"LIVING TOGETHER AS AN ACCEPTABLE OPTION",2.913,1.0,5.0,1.298,5058.0,54541.0,1.685
cohabfst,"PEOPLE SHOULD LIVE TOGETHER BEFORE MARRIAGE",2.966,1.0,5.0,1.292,3778.0,55821.0,1.669
divbest,"DIVORCE AS BEST SOLUTION TO MARITAL PROBLEMS",2.848,1.0,5.0,1.159,3806.0,55793.0,1.343
divifkd1,"SHOULD FEUDING PARENTS STAY TOGETHER FOR KIDS",3.676,1.0,5.0,1.002,1350.0,58249.0,1.003
divnokd1,"CHILDLESS COUPLES STAY MARRIED EVEN WITH PROBLEMS",4.019,1.0,5.0,0.891,1360.0,58239.0,0.794
livnowed,"DID R LIVE WITH PARTNER BEFORE MARRIAGE",3.395,1.0,4.0,1.143,1310.0,58289.0,1.306
